Job Title,Company Name,Portal Name,Location,Job Mode,Experience Required,Date Posted,Salary Range,Role Domain,Job Tags,Application Method,Fresher Friendly
Senior MLOps Engineer,Daniel J Edelman Holdings,Remote OK,Remote,Remote,Senior,06-10-2025,Not specified,Information Technology (IT),"grafana, system, security, python, training, support, travel, voice, cloud, lead, senior, junior, engineer, engineering",Apply via Remote OK (https://remoteok.comhttps://remoteOK.com/remote-jobs/remote-senior-mlops-engineer-daniel-j-edelman-holdings-1128452),No
Engineering Lead Custody,BitMEX,Remote OK,Remote,Remote,Senior,06-10-2025,Not specified,Information Technology (IT),"crypto, cryptocurrency, security, lead, engineering",Apply via Remote OK (https://remoteok.comhttps://remoteOK.com/remote-jobs/remote-engineering-lead-custody-bitmex-1128451),No
Support and Communications Specialist,Interaction Design Foundation,Remote OK,Remote,Remote,Entry Level,06-10-2025,Not specified,Information Technology (IT),"customer support, copywriting, content writing",Apply via Remote OK (https://remoteok.comhttps://remoteOK.com/remote-jobs/remote-support-and-communications-specialist-interaction-design-foundation-1128449),Yes
Senior Analytics Engineer GTM,Bitwise Asset Management,Remote OK,Remote,Remote,Senior,06-10-2025,Not specified,Information Technology (IT),"crypto, support, manager, financial, exec, lead, senior, marketing, analytics, sales, engineer, engineering",Apply via Remote OK (https://remoteok.comhttps://remoteOK.com/remote-jobs/remote-senior-analytics-engineer-gtm-bitwise-asset-management-1128448),No
Founding CTO,Stealth Startup,Remote OK,Remote,Remote,Entry Level,06-10-2025,Not specified,Information Technology (IT),"engineer, dev, javascript, node",Apply via Remote OK (https://remoteok.comhttps://remoteOK.com/remote-jobs/remote-founding-cto-stealth-startup-1128447),Yes
Staff Engineer,The Block,Remote OK,Remote,Remote,Entry Level,06-10-2025,Not specified,Information Technology (IT),"crypto, cryptocurrency, frontend, full-stack, technical, code, web, voice, qa, devops, financial, laravel, content, analytics, legal, health, engineer, engineering, backend",Apply via Remote OK (https://remoteok.comhttps://remoteOK.com/remote-jobs/remote-staff-engineer-the-block-1128446),Yes
Software Engineer,Celonis,Remote OK,Remote,Remote,Entry Level,04-10-2025,Not specified,Information Technology (IT),"software, saas, support, java, leader, reliability, engineer, engineering, backend",Apply via Remote OK (https://remoteok.comhttps://remoteOK.com/remote-jobs/remote-software-engineer-celonis-1128444),Yes
QA Lead,Allata,Remote OK,Remote,Remote,Senior,03-10-2025,Not specified,Information Technology (IT),"jira, saas, security, consulting, architect, testing, test, ui, qa, cloud, api, strategy, lead, marketing, analytics, sales, reliability, engineering",Apply via Remote OK (https://remoteok.comhttps://remoteOK.com/remote-jobs/remote-qa-lead-allata-1128443),No
Senior Account Executive,Agiloft,Remote OK,Remote,Remote,Senior,03-10-2025,Not specified,Information Technology (IT),"saas, consulting, technical, support, software, growth, code, cloud, leader, strategy, management, lead, senior, operations, legal, sales, go, recruiting, engineering, executive",Apply via Remote OK (https://remoteok.comhttps://remoteOK.com/remote-jobs/remote-senior-account-executive-agiloft-1128442),No
Senior Territory Sales Manager,Revinate,Remote OK,Remote,Remote,Senior,03-10-2025,Not specified,Information Technology (IT),"manager, saas, software, director, senior, marketing, sales",Apply via Remote OK (https://remoteok.comhttps://remoteOK.com/remote-jobs/remote-senior-territory-sales-manager-revinate-1128441),No
Staff Software Engineer,EnergyHub,Remote OK,Remote,Remote,Entry Level,03-10-2025,Not specified,Information Technology (IT),"software, technical, support, test, education, operations, engineer, engineering",Apply via Remote OK (https://remoteok.comhttps://remoteOK.com/remote-jobs/remote-staff-software-engineer-energyhub-1128440),Yes
Join Our Renewal Manager Talent Pipeline,Magnet Forensics,Remote OK,Remote,Remote,Senior,03-10-2025,Not specified,Information Technology (IT),"manager, embedded, software, leader, management, sales, recruitment",Apply via Remote OK (https://remoteok.comhttps://remoteOK.com/remote-jobs/remote-join-our-renewal-manager-talent-pipeline-magnet-forensics-1128439),No
Senior Full Stack Software Engineer Financial Reports Team,Houzz,Remote OK,Remote,Remote,Senior,03-10-2025,Not specified,Information Technology (IT),"software, design, saas, technical, support, developer, test, ux, code, web, financial, management, lead, senior, marketing, engineer, backend, digital nomad",Apply via Remote OK (https://remoteok.comhttps://remoteOK.com/remote-jobs/remote-senior-full-stack-software-engineer-financial-reports-team-houzz-1128438),No
Technical Customer Success Manager,Photoroom,Remote OK,Remote,Remote,Senior,03-10-2025,Not specified,Information Technology (IT),"manager, saas, frontend, consult, technical, support, growth, travel, api, strategy, management, lead, health, backend",Apply via Remote OK (https://remoteok.comhttps://remoteOK.com/remote-jobs/remote-technical-customer-success-manager-photoroom-1128437),No
Partner Manager Channel and Alliances,Cyara,Remote OK,Remote,Remote,Senior,03-10-2025,Not specified,Information Technology (IT),"manager, design, software, growth, voice, chatbot, management, sales, executive, digital nomad",Apply via Remote OK (https://remoteok.comhttps://remoteOK.com/remote-jobs/remote-partner-manager-channel-and-alliances-cyara-1128436),No
Salesforce Full Stack Developer,Culligan Quench,Remote OK,Remote,Remote,Entry Level,03-10-2025,Not specified,Information Technology (IT),"salesforce, developer, design, hr, system, architect, technical, software, director, code, web, travel, devops, financial, banking, java, ruby, leader, management, lead, senior, junior, marketing, health, engineering, digital nomad",Apply via Remote OK (https://remoteok.comhttps://remoteOK.com/remote-jobs/remote-salesforce-full-stack-developer-culligan-quench-1128435),Yes
Controller,Qohash,Remote OK,Remote,Remote,Entry Level,03-10-2025,Not specified,Information Technology (IT),"controller, security, cfo, support, growth, accounting, financial, investor, sales, executive",Apply via Remote OK (https://remoteok.comhttps://remoteOK.com/remote-jobs/remote-controller-qohash-1128434),Yes
Financial Settlement Representative,Loadsmart,Remote OK,Remote,Remote,Entry Level,03-10-2025,Not specified,Information Technology (IT),"financial, operations, operational, sales, non tech",Apply via Remote OK (https://remoteok.comhttps://remoteOK.com/remote-jobs/remote-financial-settlement-representative-loadsmart-1128433),Yes
Solutions Architect WAMS,SpryPoint,Remote OK,Remote,Remote,Entry Level,03-10-2025,Not specified,Information Technology (IT),"architect, system, training, software, testing, test, growth, investment, management, lead, senior",Apply via Remote OK (https://remoteok.comhttps://remoteOK.com/remote-jobs/remote-solutions-architect-wams-sprypoint-1128432),Yes
Head of Compliance,Veda Tech Labs,Remote OK,Remote,Remote,Senior,03-10-2025,Not specified,Information Technology (IT),"design, defi, crypto, security, training, technical, support, testing, financial, finance, lead, operations, operational, engineering, executive, digital nomad",Apply via Remote OK (https://remoteok.comhttps://remoteOK.com/remote-jobs/remote-head-of-compliance-veda-tech-labs-1128431),No
Technical Engineer,CompTech Computer Technologies,Remote OK,Remote,Remote,Entry Level,04-10-2025,Not specified,Information Technology (IT),"security, technical, support, management, excel, engineer",Apply via Remote OK (https://remoteok.comhttps://remoteOK.com/remote-jobs/remote-technical-engineer-comptech-computer-technologies-1128430),Yes
Enterprise Account Executive,AuditBoard,Remote OK,Remote,Remote,Entry Level,04-10-2025,Not specified,Sales & Marketing,"saas, infosec, support, growth, manager, video, management, sales, health, executive",Apply via Remote OK (https://remoteok.comhttps://remoteOK.com/remote-jobs/remote-enterprise-account-executive-auditboard-1128429),Yes
